{"$schema":"https://json-schema.org/draft/2020-12/schema","$id":"https://rehostrace.example/schemas/binary_cfg.schema.json","title":"RehostRace normalized binary CFG","type":"object","required":["schema_version","binary","nodes","edges"],"properties":{"schema_version":{"const":"rehostrace.binary-cfg/v1"},"binary":{"type":"object"},"nodes":{"type":"array","minItems":1,"items":{"type":"object"}},"edges":{"type":"array","items":{"type":"object"}}},"additionalProperties":false}
